{"architecture_cost":{"contract_gas_or_ref_time":{"availability":"N/A","unit":"ref_time","value":null},"contract_storage_writes":{"availability":"N/A","unit":"count","value":null},"projection_storage_writes":{"availability":"N/A","unit":"count","value":null},"runtime_dispatch_count":{"availability":"measured","unit":"count","value":"1"},"runtime_storage_writes":{"availability":"not-collected","unit":"count","value":null},"typed_ce_call_count":{"availability":"N/A","unit":"count","value":null}},"claim_boundary":"formal-correctness-only; not-performance-evidence","contract_version":"phase3-adapter-contract-v1","correctness":{"critical_state_diff_count":0,"dirty_authorization_count":0,"dirty_order_count":0,"duplicate_settlement_count":0,"event_mismatch_count":0,"expected_outcome_match":true,"false_accept_count":0,"false_reject_count":0,"invariant_violation_count":0,"timeout_count":0,"unexpected_balance_delta_count":0,"unexpected_index_delta_count":0},"cost":{"completion_blocks":{"availability":"measured","unit":"blocks","value":"0"},"events_count":{"availability":"measured","unit":"count","value":"0"},"latency_ms":{"availability":"measured","unit":"ms","value":"5926"},"partial_fee":{"availability":"measured","unit":"plancks","value":"1645885297"},"phase_call_count":{"availability":"measured","unit":"count","value":"1"},"rpc_response_ms":{"availability":"not-collected","unit":"ms","value":null},"storage_writes":{"availability":"not-collected","unit":"count","value":null},"weight_proof_size":{"availability":"measured","unit":"bytes","value":"12184"},"weight_ref_time":{"availability":"measured","unit":"ref_time","value":"1537728000"}},"events":{"event_names":[],"post_state_commitment":null,"success_event_count":0},"outcome":{"common_error_code":"QuotaExceeded","completion_block":21,"completion_blocks":0,"dispatch_fee_amount":"1645885297","dispatch_fee_payer_role":"BUYER_2","dispatch_success":false,"environmental_balance_adjustments":[{"account":"0xd43593c715fdd31c61141abd04a99fd6822c8558854ccde39a5684e7a56da27d","amount":"5000000000000","block_number":21,"event_index":6,"event_phase":"Finalization","reason":"block-author-reward","role":"OWNER"}],"event_index":3,"extrinsic_index":1,"included_block":21,"native_error":"QuotaExceeded","protocol_outcome":"rejected","submission_sequence":2},"request":{"attempt_id":"fund-2","expected_error_code":null,"expected_outcome":"winner-or-loser","operation":"IssueRight","phase":"fund_order","scenario_id":"RACE-QUOTA-01"},"run":{"baseline_id":"B2","baseline_name":"Runtime-only","baseline_profile_version":"1","config_path":"configs/workloads/formal_correctness.json","git_dirty":false,"implementation_commit":"dc10ea68ffddacf93e6d57d91c9acfa35a4b1bfa","repetition":2,"run_id":"p4-e4-b2-20260805T160455+0800-dc10ea68-79eb587a","seed":20260726,"settlement_protocol_version":1,"timestamp":"2026-08-05T16:04:55+08:00","timezone":"Asia/Shanghai","validity_level":"provisional-candidate","workload_id":"formal-correctness-medium-v1"},"schema_id":"assetxchain-exp2-phase4-formal-result","schema_version":1,"settlement":{"record":null,"refund_amount":null,"refund_recipient":null,"settlement_id":null,"settlement_record_count":0},"snapshots":{"post":{"authority_source":"runtime","authorization":{"authorization_id":"0x19579ec9b9f8173cf4a48a980f67fa2aeba3b4f3d214e5c2cd3cb785466fd1fa","consumed":false,"consumed_order_id":null,"exists":true,"issued_count":0,"issued_use_units":0,"policy_hash":"0x021f0e1133291eccccec9f5e5c30a9022eac26e0c7203c05548e5b607908d5f1","reserved_count":1,"reserved_use_units":1,"status":"Active"},"baseline_id":"B2","contract_version":"phase3-adapter-contract-v1","evidence":{"pre_state_commitment":null,"record_fields_hash":null,"settlement_id":null,"settlement_record_count":0},"identity":{"authorization_nonce":0,"buyer_nonce":0,"object_state_version":1,"order_commitment_hash":"0xbffcc7cfa000e00a1b8587a48e475f78c61e706c31d173066b706936b298d93c","seller_nonce":2,"settlement_domain_id":"axc/p2/shared","settlement_protocol_version":1},"market":{"active_exposure_value":"3000000000000","active_orders":2,"capabilities":["TransferMeta","IssueRight","TransferRight"],"exists":true,"funded_orders":1,"market_id":"0x5151515151515151515151515151515151515151515151515151515151515151","status":"Active"},"meta":{"active_order_id":null,"active_right_count":0,"asset_id":"0x6262626262626262626262626262626262626262626262626262626262626262","exists":true,"owner":"0xd43593c715fdd31c61141abd04a99fd6822c8558854ccde39a5684e7a56da27d","owner_index_matches":true,"state_version":1,"status":"Tradable"},"observed_at":{"attempt_sequence":2,"block_number":21},"order":{"active_capacity_occupied":true,"buyer":null,"exists":true,"expiry":38,"funded_capacity_occupied":false,"grace_deadline":null,"operation":"IssueRight","order_id":"0x26f451b07a3e58052131a948ea36afa33facc2232971aceba9c13c83f2271372","seller":"0xd43593c715fdd31c61141abd04a99fd6822c8558854ccde39a5684e7a56da27d","state":"Open"},"payment":{"buyer_balance":"99999998354114703","escrow_amount":"0","market_balance":"100000000000000000","royalty_balance":null,"safety_balance":null,"seller_balance":"1267650600227829506491582558163","state":"Unfunded"},"projection":{"authoritative":false,"availability":"N/A","order_state":null,"settlement_record_count":null},"right":{"active_order_id":null,"exists":false,"holder":null,"holder_index_matches":null,"parent_asset_id":null,"parent_index_matches":null,"remaining_uses":null,"right_id":null,"state_version":null,"status":null,"valid":null},"schema_id":"assetxchain-exp2-normalized-snapshot","schema_version":1,"state_commitment":"0x5613ca9a86a3660e9c5abb2f48048d3b31a67f10f3050ce53eb3fb2a213a66e8"},"pre":{"authority_source":"runtime","authorization":{"authorization_id":"0x19579ec9b9f8173cf4a48a980f67fa2aeba3b4f3d214e5c2cd3cb785466fd1fa","consumed":false,"consumed_order_id":null,"exists":true,"issued_count":0,"issued_use_units":0,"policy_hash":"0x021f0e1133291eccccec9f5e5c30a9022eac26e0c7203c05548e5b607908d5f1","reserved_count":1,"reserved_use_units":1,"status":"Active"},"baseline_id":"B2","contract_version":"phase3-adapter-contract-v1","evidence":{"pre_state_commitment":null,"record_fields_hash":null,"settlement_id":null,"settlement_record_count":0},"identity":{"authorization_nonce":0,"buyer_nonce":0,"object_state_version":1,"order_commitment_hash":"0xbffcc7cfa000e00a1b8587a48e475f78c61e706c31d173066b706936b298d93c","seller_nonce":2,"settlement_domain_id":"axc/p2/shared","settlement_protocol_version":1},"market":{"active_exposure_value":"3000000000000","active_orders":2,"capabilities":["TransferMeta","IssueRight","TransferRight"],"exists":true,"funded_orders":1,"market_id":"0x5151515151515151515151515151515151515151515151515151515151515151","status":"Active"},"meta":{"active_order_id":null,"active_right_count":0,"asset_id":"0x6262626262626262626262626262626262626262626262626262626262626262","exists":true,"owner":"0xd43593c715fdd31c61141abd04a99fd6822c8558854ccde39a5684e7a56da27d","owner_index_matches":true,"state_version":1,"status":"Tradable"},"observed_at":{"attempt_sequence":2,"block_number":20},"order":{"active_capacity_occupied":true,"buyer":null,"exists":true,"expiry":38,"funded_capacity_occupied":false,"grace_deadline":null,"operation":"IssueRight","order_id":"0x26f451b07a3e58052131a948ea36afa33facc2232971aceba9c13c83f2271372","seller":"0xd43593c715fdd31c61141abd04a99fd6822c8558854ccde39a5684e7a56da27d","state":"Open"},"payment":{"buyer_balance":"100000000000000000","escrow_amount":"0","market_balance":"100000000000000000","royalty_balance":null,"safety_balance":null,"seller_balance":"1267650600227829501491582558163","state":"Unfunded"},"projection":{"authoritative":false,"availability":"N/A","order_state":null,"settlement_record_count":null},"right":{"active_order_id":null,"exists":false,"holder":null,"holder_index_matches":null,"parent_asset_id":null,"parent_index_matches":null,"remaining_uses":null,"right_id":null,"state_version":null,"status":null,"valid":null},"schema_id":"assetxchain-exp2-normalized-snapshot","schema_version":1,"state_commitment":"0x5613ca9a86a3660e9c5abb2f48048d3b31a67f10f3050ce53eb3fb2a213a66e8"}}}
