{"architecture_cost":{"contract_gas_or_ref_time":{"availability":"measured","unit":"ref_time","value":"1029345475"},"contract_storage_writes":{"availability":"not-collected","unit":"count","value":null},"projection_storage_writes":{"availability":"N/A","unit":"count","value":null},"runtime_dispatch_count":{"availability":"N/A","unit":"count","value":null},"runtime_storage_writes":{"availability":"N/A","unit":"count","value":null},"typed_ce_call_count":{"availability":"N/A","unit":"count","value":null}},"claim_boundary":"formal-correctness-only; not-performance-evidence","contract_version":"phase3-adapter-contract-v1","correctness":{"critical_state_diff_count":0,"dirty_authorization_count":0,"dirty_order_count":0,"duplicate_settlement_count":0,"event_mismatch_count":0,"expected_outcome_match":true,"false_accept_count":0,"false_reject_count":0,"invariant_violation_count":0,"timeout_count":0,"unexpected_balance_delta_count":0,"unexpected_index_delta_count":0},"cost":{"completion_blocks":{"availability":"measured","unit":"blocks","value":"0"},"events_count":{"availability":"measured","unit":"count","value":"0"},"latency_ms":{"availability":"measured","unit":"ms","value":"5926"},"partial_fee":{"availability":"measured","unit":"plancks","value":"2151570663"},"phase_call_count":{"availability":"measured","unit":"count","value":"1"},"rpc_response_ms":{"availability":"not-collected","unit":"ms","value":null},"storage_writes":{"availability":"not-collected","unit":"count","value":null},"weight_proof_size":{"availability":"measured","unit":"bytes","value":"183281"},"weight_ref_time":{"availability":"measured","unit":"ref_time","value":"2043413475"}},"events":{"event_names":[],"post_state_commitment":null,"success_event_count":0},"outcome":{"common_error_code":"AlreadySettled","completion_block":22,"completion_blocks":0,"dispatch_fee_amount":"2151570663","dispatch_fee_payer_role":"RIGHT_SELLER","dispatch_success":false,"environmental_balance_adjustments":[{"account":"0xd43593c715fdd31c61141abd04a99fd6822c8558854ccde39a5684e7a56da27d","amount":"5000000000000","block_number":22,"event_index":6,"event_phase":"Finalization","reason":"block-author-reward","role":"OWNER"}],"event_index":3,"extrinsic_index":1,"included_block":22,"native_error":"AlreadySettled","protocol_outcome":"rejected","submission_sequence":3},"request":{"attempt_id":"relay-3","expected_error_code":null,"expected_outcome":"winner-or-loser","operation":"TransferRight","phase":"settle","scenario_id":"RACE-RELAYER-01"},"run":{"baseline_id":"B1","baseline_name":"Contract-only","baseline_profile_version":"1","config_path":"configs/workloads/formal_correctness.json","git_dirty":false,"implementation_commit":"8514bf0720ec9b5ed3c8d3ec1501264ae7bf1642","repetition":5,"run_id":"p4-e5-b1-20260805T202141+0800-8514bf07-79eb587a","seed":20260726,"settlement_protocol_version":1,"timestamp":"2026-08-05T20:21:41+08:00","timezone":"Asia/Shanghai","validity_level":"provisional-candidate","workload_id":"formal-correctness-medium-v1"},"schema_id":"assetxchain-exp2-phase4-formal-result","schema_version":1,"settlement":{"record":null,"refund_amount":null,"refund_recipient":null,"settlement_id":null,"settlement_record_count":1},"snapshots":{"post":{"authority_source":"contract","authorization":{"authorization_id":"0x11aeb8de8c0537ed951126bd3cdc6ebdcdf6311cfdb6164dde3d4ec3b681f593","consumed":false,"consumed_order_id":null,"exists":true,"issued_count":0,"issued_use_units":0,"policy_hash":"0x94ad0e04d9fd76b83ca40e8cd52e459160e1aae3fd0f7ae1ab850f3d1bd67817","reserved_count":0,"reserved_use_units":0,"status":"Active"},"baseline_id":"B1","contract_version":"phase3-adapter-contract-v1","evidence":{"pre_state_commitment":"0x38f23524e148b03147c8b204f01efad7ef763aad3f1ed5fa63f98646aadfa873","record_fields_hash":"0x2f0c5b02242014608f0cde76d52b7a48b9851a167de7278b48f20adbea7064ec","settlement_id":"0xdb427546e450dd5813ab975b6b3e8a98849a42c8e3fbb66df08b07d16cc7e98c","settlement_record_count":1},"identity":{"authorization_nonce":null,"buyer_nonce":1,"object_state_version":2,"order_commitment_hash":"0x9c192c563098928c400cc1214811f8a0c43e6283996ace3970b25f0028b7ee9b","seller_nonce":1,"settlement_domain_id":"axc/p2/shared","settlement_protocol_version":1},"market":{"active_exposure_value":"0","active_orders":0,"capabilities":["TransferMeta","IssueRight","TransferRight"],"exists":true,"funded_orders":0,"market_id":"0x6de0578ed7f29849f1599ab8b0be77a668e632e018c85157bf23f09961e8771d","status":"0"},"meta":{"active_order_id":null,"active_right_count":1,"asset_id":"0x6363636363636363636363636363636363636363636363636363636363636363","exists":true,"owner":"0xd43593c715fdd31c61141abd04a99fd6822c8558854ccde39a5684e7a56da27d","owner_index_matches":true,"state_version":1,"status":"Tradable"},"observed_at":{"attempt_sequence":3,"block_number":22},"order":{"active_capacity_occupied":false,"buyer":"0x306721211d5404bd9da88e0204360a1a9ab8b87c66c1bc2fcdd37f3c2222cc20","exists":true,"expiry":38,"funded_capacity_occupied":false,"grace_deadline":29,"operation":"TransferRight","order_id":"0xb2c8da72b827a948f9b9ec1828dcd25e9f4ee7441afa67061f10c664c08dcbe6","seller":"0x8eaf04151687736326c9fea17e25fc5287613693c912909cb226aa4794f26a48","state":"Settled"},"payment":{"buyer_balance":"99972654920016735","escrow_amount":"4000000000000","market_balance":"100000000000000000","royalty_balance":null,"safety_balance":null,"seller_balance":"1267650600228229405494551634713","state":"Released"},"projection":{"authoritative":false,"availability":"N/A","order_state":null,"settlement_record_count":null},"right":{"active_order_id":null,"exists":true,"holder":"0x306721211d5404bd9da88e0204360a1a9ab8b87c66c1bc2fcdd37f3c2222cc20","holder_index_matches":true,"parent_asset_id":"0x6363636363636363636363636363636363636363636363636363636363636363","parent_index_matches":true,"remaining_uses":1,"right_id":"0x7373737373737373737373737373737373737373737373737373737373737373","state_version":2,"status":"Active","valid":true},"schema_id":"assetxchain-exp2-normalized-snapshot","schema_version":1,"state_commitment":"0xa9591fc84c1f412436cb5ca985d5a932dc5d97e4df3e65baa3bf418932891c0a"},"pre":{"authority_source":"contract","authorization":{"authorization_id":"0x11aeb8de8c0537ed951126bd3cdc6ebdcdf6311cfdb6164dde3d4ec3b681f593","consumed":false,"consumed_order_id":null,"exists":true,"issued_count":0,"issued_use_units":0,"policy_hash":"0x94ad0e04d9fd76b83ca40e8cd52e459160e1aae3fd0f7ae1ab850f3d1bd67817","reserved_count":0,"reserved_use_units":0,"status":"Active"},"baseline_id":"B1","contract_version":"phase3-adapter-contract-v1","evidence":{"pre_state_commitment":"0x38f23524e148b03147c8b204f01efad7ef763aad3f1ed5fa63f98646aadfa873","record_fields_hash":"0x2f0c5b02242014608f0cde76d52b7a48b9851a167de7278b48f20adbea7064ec","settlement_id":"0xdb427546e450dd5813ab975b6b3e8a98849a42c8e3fbb66df08b07d16cc7e98c","settlement_record_count":1},"identity":{"authorization_nonce":null,"buyer_nonce":1,"object_state_version":2,"order_commitment_hash":"0x9c192c563098928c400cc1214811f8a0c43e6283996ace3970b25f0028b7ee9b","seller_nonce":1,"settlement_domain_id":"axc/p2/shared","settlement_protocol_version":1},"market":{"active_exposure_value":"0","active_orders":0,"capabilities":["TransferMeta","IssueRight","TransferRight"],"exists":true,"funded_orders":0,"market_id":"0x6de0578ed7f29849f1599ab8b0be77a668e632e018c85157bf23f09961e8771d","status":"0"},"meta":{"active_order_id":null,"active_right_count":1,"asset_id":"0x6363636363636363636363636363636363636363636363636363636363636363","exists":true,"owner":"0xd43593c715fdd31c61141abd04a99fd6822c8558854ccde39a5684e7a56da27d","owner_index_matches":true,"state_version":1,"status":"Tradable"},"observed_at":{"attempt_sequence":3,"block_number":21},"order":{"active_capacity_occupied":false,"buyer":"0x306721211d5404bd9da88e0204360a1a9ab8b87c66c1bc2fcdd37f3c2222cc20","exists":true,"expiry":38,"funded_capacity_occupied":false,"grace_deadline":29,"operation":"TransferRight","order_id":"0xb2c8da72b827a948f9b9ec1828dcd25e9f4ee7441afa67061f10c664c08dcbe6","seller":"0x8eaf04151687736326c9fea17e25fc5287613693c912909cb226aa4794f26a48","state":"Settled"},"payment":{"buyer_balance":"99972654920016735","escrow_amount":"4000000000000","market_balance":"100000000000000000","royalty_balance":null,"safety_balance":null,"seller_balance":"1267650600228229405496703205376","state":"Released"},"projection":{"authoritative":false,"availability":"N/A","order_state":null,"settlement_record_count":null},"right":{"active_order_id":null,"exists":true,"holder":"0x306721211d5404bd9da88e0204360a1a9ab8b87c66c1bc2fcdd37f3c2222cc20","holder_index_matches":true,"parent_asset_id":"0x6363636363636363636363636363636363636363636363636363636363636363","parent_index_matches":true,"remaining_uses":1,"right_id":"0x7373737373737373737373737373737373737373737373737373737373737373","state_version":2,"status":"Active","valid":true},"schema_id":"assetxchain-exp2-normalized-snapshot","schema_version":1,"state_commitment":"0xa9591fc84c1f412436cb5ca985d5a932dc5d97e4df3e65baa3bf418932891c0a"}}}
