{"architecture_cost":{"contract_gas_or_ref_time":{"availability":"N/A","unit":"ref_time","value":null},"contract_storage_writes":{"availability":"N/A","unit":"count","value":null},"projection_storage_writes":{"availability":"N/A","unit":"count","value":null},"runtime_dispatch_count":{"availability":"measured","unit":"count","value":"1"},"runtime_storage_writes":{"availability":"not-collected","unit":"count","value":null},"typed_ce_call_count":{"availability":"N/A","unit":"count","value":null}},"claim_boundary":"formal-correctness-only; not-performance-evidence","contract_version":"phase3-adapter-contract-v1","correctness":{"critical_state_diff_count":0,"dirty_authorization_count":0,"dirty_order_count":0,"duplicate_settlement_count":0,"event_mismatch_count":0,"expected_outcome_match":true,"false_accept_count":0,"false_reject_count":0,"invariant_violation_count":0,"timeout_count":0,"unexpected_balance_delta_count":0,"unexpected_index_delta_count":0},"cost":{"completion_blocks":{"availability":"measured","unit":"blocks","value":"0"},"events_count":{"availability":"measured","unit":"count","value":"0"},"latency_ms":{"availability":"measured","unit":"ms","value":"5996"},"partial_fee":{"availability":"measured","unit":"plancks","value":"1395885645"},"phase_call_count":{"availability":"measured","unit":"count","value":"1"},"rpc_response_ms":{"availability":"not-collected","unit":"ms","value":null},"storage_writes":{"availability":"not-collected","unit":"count","value":null},"weight_proof_size":{"availability":"measured","unit":"bytes","value":"12184"},"weight_ref_time":{"availability":"measured","unit":"ref_time","value":"1287728000"}},"events":{"event_names":[],"post_state_commitment":null,"success_event_count":0},"outcome":{"common_error_code":"RightInvalid","completion_block":18,"completion_blocks":0,"dispatch_fee_amount":"1395885645","dispatch_fee_payer_role":"RELAYER","dispatch_success":false,"environmental_balance_adjustments":[{"account":"0xd43593c715fdd31c61141abd04a99fd6822c8558854ccde39a5684e7a56da27d","amount":"5000000000000","block_number":18,"event_index":6,"event_phase":"Finalization","reason":"block-author-reward","role":"OWNER"}],"event_index":3,"extrinsic_index":1,"included_block":18,"native_error":"RightNotFound","protocol_outcome":"rejected","submission_sequence":1},"request":{"attempt_id":"reject","expected_error_code":"RightInvalid","expected_outcome":"reject","operation":"TransferRight","phase":"create_order","scenario_id":"NEG-RIGHT-MISSING-01"},"run":{"baseline_id":"B2","baseline_name":"Runtime-only","baseline_profile_version":"1","config_path":"configs/workloads/formal_correctness.json","git_dirty":false,"implementation_commit":"dc10ea68ffddacf93e6d57d91c9acfa35a4b1bfa","repetition":5,"run_id":"p4-e2-b2-20260805T031719+0800-dc10ea68-79eb587a","seed":20260726,"settlement_protocol_version":1,"timestamp":"2026-08-05T03:17:19+08:00","timezone":"Asia/Shanghai","validity_level":"provisional-candidate","workload_id":"formal-correctness-medium-v1"},"schema_id":"assetxchain-exp2-phase4-formal-result","schema_version":1,"settlement":{"record":null,"refund_amount":null,"refund_recipient":null,"settlement_id":null,"settlement_record_count":0},"snapshots":{"post":{"authority_source":"runtime","authorization":{"authorization_id":"0x70c081f87b521a24e58579df11c0ee7883bd861ba07d6b240dd4ac3792c4e440","consumed":false,"consumed_order_id":null,"exists":false,"issued_count":0,"issued_use_units":0,"policy_hash":"0x94ad0e04d9fd76b83ca40e8cd52e459160e1aae3fd0f7ae1ab850f3d1bd67817","reserved_count":0,"reserved_use_units":0,"status":null},"baseline_id":"B2","contract_version":"phase3-adapter-contract-v1","evidence":{"pre_state_commitment":null,"record_fields_hash":null,"settlement_id":null,"settlement_record_count":0},"identity":{"authorization_nonce":null,"buyer_nonce":0,"object_state_version":1,"order_commitment_hash":null,"seller_nonce":0,"settlement_domain_id":"axc/p2/shared","settlement_protocol_version":1},"market":{"active_exposure_value":"0","active_orders":0,"capabilities":["TransferMeta","IssueRight","TransferRight"],"exists":true,"funded_orders":0,"market_id":"0x5151515151515151515151515151515151515151515151515151515151515151","status":"Active"},"meta":{"active_order_id":null,"active_right_count":1,"asset_id":"0x6363636363636363636363636363636363636363636363636363636363636363","exists":true,"owner":"0xd43593c715fdd31c61141abd04a99fd6822c8558854ccde39a5684e7a56da27d","owner_index_matches":true,"state_version":1,"status":"Tradable"},"observed_at":{"attempt_sequence":1,"block_number":18},"order":{"active_capacity_occupied":false,"buyer":null,"exists":false,"expiry":null,"funded_capacity_occupied":false,"grace_deadline":null,"operation":null,"order_id":null,"seller":null,"state":null},"payment":{"buyer_balance":"100000000000000000","escrow_amount":"0","market_balance":"100000000000000000","royalty_balance":null,"safety_balance":null,"seller_balance":"1267650600228229401496703205376","state":"Unfunded"},"projection":{"authoritative":false,"availability":"N/A","order_state":null,"settlement_record_count":null},"right":{"active_order_id":null,"exists":false,"holder":null,"holder_index_matches":null,"parent_asset_id":null,"parent_index_matches":null,"remaining_uses":null,"right_id":null,"state_version":null,"status":null,"valid":null},"schema_id":"assetxchain-exp2-normalized-snapshot","schema_version":1,"state_commitment":"0x091be75388e592030a120f7226d45ac24e335deb35ade55d733050891f11ed0b"},"pre":{"authority_source":"runtime","authorization":{"authorization_id":"0x70c081f87b521a24e58579df11c0ee7883bd861ba07d6b240dd4ac3792c4e440","consumed":false,"consumed_order_id":null,"exists":false,"issued_count":0,"issued_use_units":0,"policy_hash":"0x94ad0e04d9fd76b83ca40e8cd52e459160e1aae3fd0f7ae1ab850f3d1bd67817","reserved_count":0,"reserved_use_units":0,"status":null},"baseline_id":"B2","contract_version":"phase3-adapter-contract-v1","evidence":{"pre_state_commitment":null,"record_fields_hash":null,"settlement_id":null,"settlement_record_count":0},"identity":{"authorization_nonce":null,"buyer_nonce":0,"object_state_version":1,"order_commitment_hash":null,"seller_nonce":0,"settlement_domain_id":"axc/p2/shared","settlement_protocol_version":1},"market":{"active_exposure_value":"0","active_orders":0,"capabilities":["TransferMeta","IssueRight","TransferRight"],"exists":true,"funded_orders":0,"market_id":"0x5151515151515151515151515151515151515151515151515151515151515151","status":"Active"},"meta":{"active_order_id":null,"active_right_count":1,"asset_id":"0x6363636363636363636363636363636363636363636363636363636363636363","exists":true,"owner":"0xd43593c715fdd31c61141abd04a99fd6822c8558854ccde39a5684e7a56da27d","owner_index_matches":true,"state_version":1,"status":"Tradable"},"observed_at":{"attempt_sequence":1,"block_number":17},"order":{"active_capacity_occupied":false,"buyer":null,"exists":false,"expiry":null,"funded_capacity_occupied":false,"grace_deadline":null,"operation":null,"order_id":null,"seller":null,"state":null},"payment":{"buyer_balance":"100000000000000000","escrow_amount":"0","market_balance":"100000000000000000","royalty_balance":null,"safety_balance":null,"seller_balance":"1267650600228229401496703205376","state":"Unfunded"},"projection":{"authoritative":false,"availability":"N/A","order_state":null,"settlement_record_count":null},"right":{"active_order_id":null,"exists":false,"holder":null,"holder_index_matches":null,"parent_asset_id":null,"parent_index_matches":null,"remaining_uses":null,"right_id":null,"state_version":null,"status":null,"valid":null},"schema_id":"assetxchain-exp2-normalized-snapshot","schema_version":1,"state_commitment":"0x091be75388e592030a120f7226d45ac24e335deb35ade55d733050891f11ed0b"}}}
