{"architecture_cost":{"contract_gas_or_ref_time":{"availability":"measured","unit":"ref_time","value":"1859147038"},"contract_storage_writes":{"availability":"measured","unit":"count","value":"1"},"projection_storage_writes":{"availability":"measured","unit":"count","value":"1"},"runtime_dispatch_count":{"availability":"measured","unit":"count","value":"1"},"runtime_storage_writes":{"availability":"measured","unit":"count","value":"43"},"typed_ce_call_count":{"availability":"measured","unit":"count","value":"1"}},"claim_boundary":"formal-cost-candidate; fixed-medium-load-only; not-paper-final","contract_version":"phase3-adapter-contract-v1","correctness":{"critical_state_diff_count":0,"dirty_authorization_count":0,"dirty_order_count":0,"duplicate_settlement_count":0,"event_mismatch_count":0,"expected_outcome_match":true,"false_accept_count":0,"false_reject_count":0,"invariant_violation_count":0,"timeout_count":0,"unexpected_balance_delta_count":0,"unexpected_index_delta_count":0},"cost":{"completion_blocks":{"availability":"measured","unit":"blocks","value":"0"},"events_count":{"availability":"measured","unit":"count","value":"3"},"latency_ms":{"availability":"measured","unit":"ms","value":"5417"},"partial_fee":{"availability":"measured","unit":"plancks","value":"2981372386"},"phase_call_count":{"availability":"measured","unit":"count","value":"1"},"rpc_response_ms":{"availability":"measured","unit":"ms","value":"0.151"},"storage_writes":{"availability":"measured","unit":"count","value":"44"},"weight_proof_size":{"availability":"measured","unit":"bytes","value":"73925"},"weight_ref_time":{"availability":"measured","unit":"ref_time","value":"2981372038"}},"events":{"event_names":["OrderFunded","PaymentEscrowed","Called"],"post_state_commitment":null,"success_event_count":0},"outcome":{"common_error_code":null,"completion_block":23,"completion_blocks":0,"dispatch_fee_amount":"2981372386","dispatch_fee_payer_role":"BUYER_2","dispatch_success":true,"environmental_balance_adjustments":[{"account":"0xd43593c715fdd31c61141abd04a99fd6822c8558854ccde39a5684e7a56da27d","amount":"5000000000000","block_number":23,"event_index":11,"event_phase":"Finalization","reason":"block-author-reward","role":"OWNER"}],"event_index":3,"extrinsic_index":1,"included_block":23,"native_error":null,"protocol_outcome":"accepted","submission_sequence":2},"request":{"attempt_id":"fund","expected_error_code":null,"expected_outcome":"accept","operation":"TransferRight","phase":"fund_order","scenario_id":"LEG-RESALE-01"},"run":{"baseline_id":"G3","baseline_name":"AssetXChain-CRS","baseline_profile_version":"1","config_path":"configs/workloads/formal_cost_v2.json","git_dirty":false,"implementation_commit":"47ebd794c4ef1264bb8265c49d8e92c5b44e6323","repetition":5,"run_id":"p4-e6-g3-20260807T032220+0800-47ebd794-9a8b56c2","seed":20260726,"settlement_protocol_version":1,"timestamp":"2026-08-07T03:22:20+08:00","timezone":"Asia/Shanghai","validity_level":"provisional-candidate","workload_id":"formal-cost-medium-v2"},"schema_id":"assetxchain-exp2-phase4-formal-result","schema_version":1,"settlement":{"record":null,"refund_amount":null,"refund_recipient":null,"settlement_id":null,"settlement_record_count":0},"snapshots":{"post":{"authority_source":"runtime","authorization":{"authorization_id":"0x4545630799eb3e0f681062edab7093c8e20397fd6d679ad827cb09b8211b3ee2","consumed":false,"consumed_order_id":null,"exists":true,"issued_count":0,"issued_use_units":0,"policy_hash":"0x94ad0e04d9fd76b83ca40e8cd52e459160e1aae3fd0f7ae1ab850f3d1bd67817","reserved_count":0,"reserved_use_units":0,"status":"Active"},"baseline_id":"G3","contract_version":"phase3-adapter-contract-v1","evidence":{"pre_state_commitment":null,"record_fields_hash":null,"settlement_id":null,"settlement_record_count":0},"identity":{"authorization_nonce":null,"buyer_nonce":1,"object_state_version":1,"order_commitment_hash":"0x2596f4547c5683ed1eb06f96263f0bb20924c9d220966a481f5d3007c2a102df","seller_nonce":1,"settlement_domain_id":"axc/p2/shared","settlement_protocol_version":1},"market":{"active_exposure_value":"4000000000000","active_orders":1,"capabilities":["TransferMeta","IssueRight","TransferRight"],"exists":true,"funded_orders":1,"market_id":"0x9a9b94f3c5a1af7163e466a6f19fa869819cc9097825652de4cec94f3f08a24c","status":"Active"},"meta":{"active_order_id":null,"active_right_count":1,"asset_id":"0x899f8319fb6d274a8337a4527805707ed63a31fac97c2febbe733f577ed5a8c4","exists":true,"owner":"0xd43593c715fdd31c61141abd04a99fd6822c8558854ccde39a5684e7a56da27d","owner_index_matches":true,"state_version":1,"status":"Tradable"},"observed_at":{"attempt_sequence":2,"block_number":23},"order":{"active_capacity_occupied":true,"buyer":"0x306721211d5404bd9da88e0204360a1a9ab8b87c66c1bc2fcdd37f3c2222cc20","exists":true,"expiry":42,"funded_capacity_occupied":true,"grace_deadline":33,"operation":"TransferRight","order_id":"0x02cac8137a4a02c94e9fd85168d167ceb9e09d7e72cd5b0e309fd908cd2ec2a4","seller":"0x8eaf04151687736326c9fea17e25fc5287613693c912909cb226aa4794f26a48","state":"Funded"},"payment":{"buyer_balance":"99995997018627614","escrow_amount":"4000000000000","market_balance":"88028940260265198","royalty_balance":null,"safety_balance":null,"seller_balance":"1267650600228229398493721832990","state":"Escrowed"},"projection":{"authoritative":false,"availability":"unavailable","order_state":null,"settlement_record_count":null},"right":{"active_order_id":"0x02cac8137a4a02c94e9fd85168d167ceb9e09d7e72cd5b0e309fd908cd2ec2a4","exists":true,"holder":"0x8eaf04151687736326c9fea17e25fc5287613693c912909cb226aa4794f26a48","holder_index_matches":true,"parent_asset_id":"0x899f8319fb6d274a8337a4527805707ed63a31fac97c2febbe733f577ed5a8c4","parent_index_matches":true,"remaining_uses":1,"right_id":"0x079208567084e7bdc0a0a5d0bcc64b6b29097bef7ce20590f564a00ae995dfd9","state_version":1,"status":"Active","valid":true},"schema_id":"assetxchain-exp2-normalized-snapshot","schema_version":1,"state_commitment":"0x9ac48ccb63ea94e2d274acac64b37d8dee946c79efe1ee22e64c483b960ee0e3"},"pre":{"authority_source":"runtime","authorization":{"authorization_id":"0x4545630799eb3e0f681062edab7093c8e20397fd6d679ad827cb09b8211b3ee2","consumed":false,"consumed_order_id":null,"exists":true,"issued_count":0,"issued_use_units":0,"policy_hash":"0x94ad0e04d9fd76b83ca40e8cd52e459160e1aae3fd0f7ae1ab850f3d1bd67817","reserved_count":0,"reserved_use_units":0,"status":"Active"},"baseline_id":"G3","contract_version":"phase3-adapter-contract-v1","evidence":{"pre_state_commitment":null,"record_fields_hash":null,"settlement_id":null,"settlement_record_count":0},"identity":{"authorization_nonce":null,"buyer_nonce":0,"object_state_version":1,"order_commitment_hash":"0x2596f4547c5683ed1eb06f96263f0bb20924c9d220966a481f5d3007c2a102df","seller_nonce":1,"settlement_domain_id":"axc/p2/shared","settlement_protocol_version":1},"market":{"active_exposure_value":"0","active_orders":1,"capabilities":["TransferMeta","IssueRight","TransferRight"],"exists":true,"funded_orders":0,"market_id":"0x9a9b94f3c5a1af7163e466a6f19fa869819cc9097825652de4cec94f3f08a24c","status":"Active"},"meta":{"active_order_id":null,"active_right_count":1,"asset_id":"0x899f8319fb6d274a8337a4527805707ed63a31fac97c2febbe733f577ed5a8c4","exists":true,"owner":"0xd43593c715fdd31c61141abd04a99fd6822c8558854ccde39a5684e7a56da27d","owner_index_matches":true,"state_version":1,"status":"Tradable"},"observed_at":{"attempt_sequence":2,"block_number":22},"order":{"active_capacity_occupied":true,"buyer":null,"exists":true,"expiry":42,"funded_capacity_occupied":false,"grace_deadline":null,"operation":"TransferRight","order_id":"0x02cac8137a4a02c94e9fd85168d167ceb9e09d7e72cd5b0e309fd908cd2ec2a4","seller":"0x8eaf04151687736326c9fea17e25fc5287613693c912909cb226aa4794f26a48","state":"Open"},"payment":{"buyer_balance":"100000000000000000","escrow_amount":"0","market_balance":"88028940260265198","royalty_balance":null,"safety_balance":null,"seller_balance":"1267650600228229398493721832990","state":"Unfunded"},"projection":{"authoritative":false,"availability":"unavailable","order_state":null,"settlement_record_count":null},"right":{"active_order_id":"0x02cac8137a4a02c94e9fd85168d167ceb9e09d7e72cd5b0e309fd908cd2ec2a4","exists":true,"holder":"0x8eaf04151687736326c9fea17e25fc5287613693c912909cb226aa4794f26a48","holder_index_matches":true,"parent_asset_id":"0x899f8319fb6d274a8337a4527805707ed63a31fac97c2febbe733f577ed5a8c4","parent_index_matches":true,"remaining_uses":1,"right_id":"0x079208567084e7bdc0a0a5d0bcc64b6b29097bef7ce20590f564a00ae995dfd9","state_version":1,"status":"Active","valid":true},"schema_id":"assetxchain-exp2-normalized-snapshot","schema_version":1,"state_commitment":"0x914f9d6b5a3bedfb7ca43b3c09d3733fe3a7e4d73e2e25c27320de50be6eff5d"}}}
