{"architecture_cost":{"contract_gas_or_ref_time":{"availability":"N/A","unit":"ref_time","value":null},"contract_storage_writes":{"availability":"N/A","unit":"count","value":null},"projection_storage_writes":{"availability":"N/A","unit":"count","value":null},"runtime_dispatch_count":{"availability":"measured","unit":"count","value":"1"},"runtime_storage_writes":{"availability":"measured","unit":"count","value":"27"},"typed_ce_call_count":{"availability":"N/A","unit":"count","value":null}},"claim_boundary":"formal-cost-candidate; fixed-medium-load-only; not-paper-final","contract_version":"phase3-adapter-contract-v1","correctness":{"critical_state_diff_count":0,"dirty_authorization_count":0,"dirty_order_count":0,"duplicate_settlement_count":0,"event_mismatch_count":0,"expected_outcome_match":true,"false_accept_count":0,"false_reject_count":0,"invariant_violation_count":0,"timeout_count":0,"unexpected_balance_delta_count":0,"unexpected_index_delta_count":0},"cost":{"completion_blocks":{"availability":"measured","unit":"blocks","value":"0"},"events_count":{"availability":"measured","unit":"count","value":"1"},"latency_ms":{"availability":"measured","unit":"ms","value":"4272"},"partial_fee":{"availability":"measured","unit":"plancks","value":"1395885559"},"phase_call_count":{"availability":"measured","unit":"count","value":"1"},"rpc_response_ms":{"availability":"measured","unit":"ms","value":"0.116"},"storage_writes":{"availability":"measured","unit":"count","value":"27"},"weight_proof_size":{"availability":"measured","unit":"bytes","value":"12184"},"weight_ref_time":{"availability":"measured","unit":"ref_time","value":"1287728000"}},"events":{"event_names":["OrderCreated"],"post_state_commitment":null,"success_event_count":0},"outcome":{"common_error_code":null,"completion_block":18,"completion_blocks":0,"dispatch_fee_amount":"1395885559","dispatch_fee_payer_role":"RELAYER","dispatch_success":true,"environmental_balance_adjustments":[{"account":"0xd43593c715fdd31c61141abd04a99fd6822c8558854ccde39a5684e7a56da27d","amount":"5000000000000","block_number":18,"event_index":7,"event_phase":"Finalization","reason":"block-author-reward","role":"OWNER"}],"event_index":2,"extrinsic_index":1,"included_block":18,"native_error":null,"protocol_outcome":"accepted","submission_sequence":1},"request":{"attempt_id":"create","expected_error_code":null,"expected_outcome":"accept","operation":"TransferMeta","phase":"create_order","scenario_id":"LEG-META-01"},"run":{"baseline_id":"B2","baseline_name":"Runtime-only","baseline_profile_version":"1","config_path":"configs/workloads/formal_cost.json","git_dirty":false,"implementation_commit":"dc10ea68ffddacf93e6d57d91c9acfa35a4b1bfa","repetition":1,"run_id":"p4-e6-b2-20260806T111142+0800-dc10ea68-b140542f","seed":20260726,"settlement_protocol_version":1,"timestamp":"2026-08-06T11:11:42+08:00","timezone":"Asia/Shanghai","validity_level":"provisional-candidate","workload_id":"formal-cost-medium-v1"},"schema_id":"assetxchain-exp2-phase4-formal-result","schema_version":1,"settlement":{"record":null,"refund_amount":null,"refund_recipient":null,"settlement_id":null,"settlement_record_count":0},"snapshots":{"post":{"authority_source":"runtime","authorization":{"authorization_id":"0xd395e4ab50dc93140189374416b5550ab5f6e62613077393cd1ff0b696940b33","consumed":false,"consumed_order_id":null,"exists":true,"issued_count":0,"issued_use_units":0,"policy_hash":"0x53572b80fa7554668a6382b40d4cb053cd7f41d4bf187bbb4a984eaeb2686f5a","reserved_count":0,"reserved_use_units":0,"status":"Active"},"baseline_id":"B2","contract_version":"phase3-adapter-contract-v1","evidence":{"pre_state_commitment":null,"record_fields_hash":null,"settlement_id":null,"settlement_record_count":0},"identity":{"authorization_nonce":0,"buyer_nonce":0,"object_state_version":1,"order_commitment_hash":"0x2ae384502b7b97575f7b43ef223e2f4704d45f93bfb96f122776a8e5c5d080a8","seller_nonce":1,"settlement_domain_id":"axc/p2/shared","settlement_protocol_version":1},"market":{"active_exposure_value":"0","active_orders":1,"capabilities":["TransferMeta","IssueRight","TransferRight"],"exists":true,"funded_orders":0,"market_id":"0x5151515151515151515151515151515151515151515151515151515151515151","status":"Active"},"meta":{"active_order_id":"0x8a4742471819e20f3e4fa816d16fc69d25c873327dfbc18a32d39a8eb41621bc","active_right_count":0,"asset_id":"0x6161616161616161616161616161616161616161616161616161616161616161","exists":true,"owner":"0xd43593c715fdd31c61141abd04a99fd6822c8558854ccde39a5684e7a56da27d","owner_index_matches":true,"state_version":1,"status":"Tradable"},"observed_at":{"attempt_sequence":1,"block_number":18},"order":{"active_capacity_occupied":true,"buyer":null,"exists":true,"expiry":38,"funded_capacity_occupied":false,"grace_deadline":null,"operation":"TransferMeta","order_id":"0x8a4742471819e20f3e4fa816d16fc69d25c873327dfbc18a32d39a8eb41621bc","seller":"0xd43593c715fdd31c61141abd04a99fd6822c8558854ccde39a5684e7a56da27d","state":"Open"},"payment":{"buyer_balance":"100000000000000000","escrow_amount":"0","market_balance":"100000000000000000","royalty_balance":null,"safety_balance":null,"seller_balance":"1267650600227829491491557558202","state":"Unfunded"},"projection":{"authoritative":false,"availability":"N/A","order_state":null,"settlement_record_count":null},"right":{"active_order_id":null,"exists":false,"holder":null,"holder_index_matches":null,"parent_asset_id":null,"parent_index_matches":null,"remaining_uses":null,"right_id":null,"state_version":null,"status":null,"valid":null},"schema_id":"assetxchain-exp2-normalized-snapshot","schema_version":1,"state_commitment":"0x9c02ece9072b9069b3fb14098ebee6a83dd7657ce2ca003f726455f1406880ae"},"pre":{"authority_source":"runtime","authorization":{"authorization_id":"0xd395e4ab50dc93140189374416b5550ab5f6e62613077393cd1ff0b696940b33","consumed":false,"consumed_order_id":null,"exists":true,"issued_count":0,"issued_use_units":0,"policy_hash":"0x53572b80fa7554668a6382b40d4cb053cd7f41d4bf187bbb4a984eaeb2686f5a","reserved_count":0,"reserved_use_units":0,"status":"Active"},"baseline_id":"B2","contract_version":"phase3-adapter-contract-v1","evidence":{"pre_state_commitment":null,"record_fields_hash":null,"settlement_id":null,"settlement_record_count":0},"identity":{"authorization_nonce":0,"buyer_nonce":0,"object_state_version":1,"order_commitment_hash":null,"seller_nonce":0,"settlement_domain_id":"axc/p2/shared","settlement_protocol_version":1},"market":{"active_exposure_value":"0","active_orders":0,"capabilities":["TransferMeta","IssueRight","TransferRight"],"exists":true,"funded_orders":0,"market_id":"0x5151515151515151515151515151515151515151515151515151515151515151","status":"Active"},"meta":{"active_order_id":null,"active_right_count":0,"asset_id":"0x6161616161616161616161616161616161616161616161616161616161616161","exists":true,"owner":"0xd43593c715fdd31c61141abd04a99fd6822c8558854ccde39a5684e7a56da27d","owner_index_matches":true,"state_version":1,"status":"Tradable"},"observed_at":{"attempt_sequence":1,"block_number":17},"order":{"active_capacity_occupied":false,"buyer":null,"exists":false,"expiry":null,"funded_capacity_occupied":false,"grace_deadline":null,"operation":null,"order_id":null,"seller":null,"state":null},"payment":{"buyer_balance":"100000000000000000","escrow_amount":"0","market_balance":"100000000000000000","royalty_balance":null,"safety_balance":null,"seller_balance":"1267650600227829486491557558202","state":"Unfunded"},"projection":{"authoritative":false,"availability":"N/A","order_state":null,"settlement_record_count":null},"right":{"active_order_id":null,"exists":false,"holder":null,"holder_index_matches":null,"parent_asset_id":null,"parent_index_matches":null,"remaining_uses":null,"right_id":null,"state_version":null,"status":null,"valid":null},"schema_id":"assetxchain-exp2-normalized-snapshot","schema_version":1,"state_commitment":"0xef7a1de02e8e1294118dc01513972d300c1e07ce953a918b2b6e359f05a8dd51"}}}
